Query,Response,Note
Can you use Topcoder for SAP programming?  Give examples and use fewer than 1000 words.,"
I did a quick search for more information and here's what I discovered.

Yes, Topcoder has hosted challenges that involve SAP programming. For example, they ran a hackathon titled ""Hackathon - Build Simple SAP Apps,"" where participants were required to build simple web applications using SAP Fiori and SAP Cloud Platform. The challenge aimed to demonstrate the integration of these technologies for potential projects on Topcoder. Participants had to create an application with at least 2-3 screens, accessible from mobile browsers, using SAP Fiori for the front end and SAP Cloud Platform for the back end__.https://www.topcoder.com/challenges/30065862

Another challenge titled ""Unable to login to HR portal - SAP Fiori"" involved troubleshooting and fixing issues with SAP Fiori applications, indicating that participants are working directly with SAP technologies to solve real-world problems__.  )(ttps://www.topcoder.com/challenges/30322189)

Additionally, a challenge named ""KT Task 1"" focused on SAP Sourcing and Contract Lifecycle Management (CLM), showing Topcoder's engagement with specialized SAP modules__. https://www.topcoder.com/challenges/5106409f-dda2-4b37-9779-17baa294783b#:~:text=URL%3A%20https%3A%2F%2Fwww.topcoder.com%2Fchallenges%2F5106409f,ID%3A%2030332311

These challenges reflect Topcoder's capacity to handle SAP-related projects, enabling developers to contribute to various aspects of SAP programming, from front-end app development using SAP Fiori to backend services on the SAP Cloud Platform.",
Can Topcoder work with patient data?  How does topcoder protect patient data?  Give examples and use fewer than 1000 words.,"Topcoder has stringent data protection practices in place, which include agreements like NDAs, project atomization (breaking down into smaller segments), pseudonyms, data obfuscation, metaphors, direct reviews, and ring-fenced crowds. This multi-layered approach ensures that sensitive information, such as patient data, is handled with the highest degree of privacy and security. Topcoder also keeps evolving these practices, with differential privacy being a new area they are exploring to enhance data protection further_ https://www.topcoder.com/blog/layers-of-data-protection-at-topcoder/",A better answer would give examples of TC's differential privacy work.