Query,Response,Note
Has Topcoder built solutions in the Energy sector?  List the type of problems and list case studies and examples. Provide links to case studies if there are any.,"""Topcoder has developed several solutions for the energy sector, addressing various challenges with innovative technological approaches. Here are some examples of the types of problems they have tackled and solutions provided:
1.	Proximity Hazard Detection: Topcoder developed a computer vision tool for the oil and gas extraction industry to automate hazard detection. This tool analyzes video to detect changes in worker and equipment movement, alerting workers to impending hazards and triggering automatic stops on machinery to enhance safety.
2.	Worker Safety PPE Monitoring: For oil and gas workers, Topcoder helped develop a solution for monitoring the proper use of personal protective equipment (PPE). Using a detailed, labeled dataset of worker PPE usage, they created a tool that reviews incoming video and flags improper PPE usage, allowing for more efficient and less intrusive safety management. https://www.topcoder.com/customer/energy-utilities/#:~:text=HOW%20TOPCODER%20HELPS%20OIL%20%26,effectively
3.	Aquifer Boundary Identification: In the oil well siting process, identifying aquifer boundaries is crucial for preventing accidents. Topcoder hosted a data science competition that produced an algorithm capable of estimating aquifer boundaries with high accuracy, using a dataset of known aquifer depths. This tool aids in preventing accidents during drilling. https://www.topcoder.com/blog/crowdsourcing-in-the-energy-sector/#:~:text=Crowdsourcing%20in%20the%20energy%20sector,specific%20solutions
4.	Additional Projects: Other projects in the energy sector include complex mud logging, fault identification for oil well siting, and pipeline threat detection. These solutions showcase Topcoder's ability to provide diverse and impactful solutions to the energy sector through its crowdsourcing platform. https://www.topcoder.com/blog/accident-prevention-energy-power/#:~:text=These%20solutions%2C%20and%20more%20project,siting%2C%20and%20pipeline%20threat%20detection
For more detailed information and additional case studies, Topcoder has an e-Book titled ""See What Lies Beyond the Surface: Energy + Topcoder Data Science & Analytics,"" which can be accessed here.""",
What sorts of problems has Topcoder addressed in DNA research? Provide links to case studies where possible. Keep your answer to fewer than 1000 words.,"""Topcoder has been involved in several groundbreaking projects in the field of DNA research and precision medicine, collaborating with institutions like Harvard to push the boundaries of medical science using data analytics and artificial intelligence. Here are some notable examples:
1.	Harvard Tumor Hunt: This project aimed to improve lung cancer treatment by creating and testing automatic delineation algorithms. These algorithms were designed to enhance the treatment of cancerous tumors in patients' lungs by automating the process of tumor delineation. This process, which typically involves manual measurement of treatment field borders of tumors, is time-consuming and subject to individual bias. The Topcoder-Harvard collaboration successfully developed an algorithm that not only matched the accuracy of an average radiology expert but also exceeded in processing speed and consistency. The project brought together 31 of Topcoder's top data scientists and resulted in an AI solution that showed a 9-12% boost in accuracy compared to human experts. This solution significantly reduced the time taken for segmenting lung tumors on patient CT scans from 10-30 minutes to just seconds, which could be particularly beneficial for underserved areas where the number of radiation oncologists is limited. link
2.	DNA Sequencing Challenges: Topcoder has hosted contests to develop algorithms for DNA sequencing. In one such contest, the challenge was to align multiple DNA sequences to a reference DNA. This task required the alignment to be fast, accurate, and to test for potential redundancies. These types of challenges are crucial for advancing research in genetics and biology, as they address the need for efficient and accurate processing of genetic data. link
3.	Connectivity Map Challenge: Another challenge focused on the Connectivity Map (CMAP), a collection of genome-wide transcriptional expression data from human cells treated with various bioactive small molecules. The goal of this contest was to improve the accuracy of inferred gene expression values while minimizing the number of measured gene expressions. Success in this challenge could further expand research possibilities for computational biologists and scientists in drug discovery and disease treatment. link
4.	Myeloma Progression Predictor: This project involved creating advanced algorithms using real genetic data to help predict cancer progression. This challenge was critical in aiding researchers and clinicians to better understand and anticipate the progression of myeloma, a type of cancer. link
These case studies illustrate Topcoder's significant contributions to the field of DNA research and cancer treatment, showcasing how crowd-sourced data science can drive innovation and provide practical solutions in complex medical fields. For more detailed information about these projects, you can explore their case studies on Topcoder's website.""",
Can you provide more detail on the myeloma projects?,"""The Myeloma Progression Predictor project at Topcoder was an initiative to develop advanced algorithms using real genetic data for predicting cancer progression. This challenge was a collaboration involving the Multiple Myeloma Research Foundation (MMRF), Harvard, and Topcoder, highlighting the importance of algorithmic solutions in addressing critical healthcare challenges. The project's goal was to leverage the power of data science and crowdsourcing to create predictive models that could significantly impact cancer research and treatment. The total prize purse for this challenge was $20,000. For more detailed information, you can refer to Topcoder's health page https://go.topcoder.com/health/.""",This query and the next are meant to build on the previous.  It will only work if the solution is caching responses.
Can you provide more detail on the CMAP work?,"""The Connectivity Map 1 (CMAP1) challenge at Topcoder focused on utilizing a collection of genome-wide transcriptional expression data from human cells treated with bioactive small molecules. The objective was to maximize the accuracy of inferred gene expression values while minimizing the number of gene expressions measured. This integration of data and pattern-matching algorithms aimed to enable discoveries of functional connections between drugs, genes, and diseases through common gene-expression changes. The results from this challenge were expected to broaden research opportunities for computational biologists and scientists in drug discovery and disease treatment. For more information, please visit Topcoder's health page.""",
What sorts of problems has Topcoder addressed in time series predictions or forecasts? In which industries did Topcoder do this work? Provide links to case studies where possible. Keep your answer to fewer than 1000 words.,"I did a quick search and here's what I found. https://chat.openai.com/backend-api/bing/redirect?query=Topcoder+time+series+predictions+forecasts+case+studies
Topcoder has tackled various projects involving time series predictions and forecasts across different industries, though specific case studies in this area are not readily available on their website. They have worked on diverse challenges, such as helping NASA with innovative data science approaches for comet discovery and rapidly innovating mobile telemedicine apps. While these projects hint at the application of data analytics and forecasting methods, detailed case studies on time series predictions or forecasts specifically were not found in the provided resources. For a broader overview of the projects and industries Topcoder has worked with, you can explore their case studies archive at Topcoder Case Studies.","The answer provided is a bad one, because the time series results (apparently) arent visible on the site.  But the case studies do include them.  The new solutions should outperform ChatGPT on this response"
What sorts of problems has Topcoder addressed in collaborative forecasting? In which industries did Topcoder do this work? Provide links to case studies where possible. Keep your answer to fewer than 1000 words. ,"Topcoder has engaged in various projects across different industries, but specific details on collaborative forecasting were not found in their case studies archive. They have worked on diverse challenges, such as helping NASA discover new comets and innovating mobile telemedicine apps. While these projects demonstrate Topcoder's capability in data analytics and problem-solving, there was no direct information about their involvement in collaborative forecasting projects. For a comprehensive view of the projects and industries Topcoder has worked in, you can explore their case studies archive here.","The answer provided is a bad one, because the collaborative results (apparently) arent visible on the site.  But the case studies do include them.  The new solutions should outperform ChatGPT on this response"
Has Topcoder built mobile apps for healthcare?  Does it protect patient data? Provide links to case studies where possible. Keep your answer to fewer than 1000 words. ,"Yes, Topcoder has developed mobile apps for healthcare. One notable example is the Ognomy Sleep Platform, a mobile telemedicine app designed to reimagine sleep centers and enhance health. This project demonstrates Topcoder's capability to rapidly innovate in the healthcare sector. While specific details about patient data protection in these projects were not found, it is common practice in healthcare app development to prioritize data security and compliance with regulations like HIPAA. For more detailed information, you can explore Topcoder's case study on the Ognomy Sleep Platform here.",The case studies include more apps than Ognomy.  A better response is expected.
how about ipad apps for the same?,"Topcoder has also been involved in developing iPad applications for healthcare. However, specific case studies or examples of iPad apps in the healthcare sector developed by Topcoder were not highlighted in the available resources. Typically, such projects would involve similar considerations for functionality, user experience, and data security as in mobile app development. For more information on Topcoder's projects in healthcare and other sectors, you can visit their Healthcare & Life Sciences case studies.",A better response would provide information about ISS-FIT
Does Topcoder do Rust?,"I did a quick search and here's what I found.

Topcoder has shown interest in the Rust programming language, recognizing its fast performance and reliable compile-time concurrency, which focuses on performance and safety. Although Rust is relatively new and has fewer libraries compared to Python, its strength in providing guaranteed memory safety makes it an attractive option for low-level system-oriented use cases. Topcoder acknowledges Rust's potential in the field of data science as an efficient and reliable backend. However, for high-level abstractions necessary in data science applications, Python remains a strong contender. For more details, you can read Topcoder's discussion on Rust here.",This is a good answer that leverages the challenge feed in addition to case studies.
Has Topcoder developed in Cobol?,"
Yes, Topcoder has been involved in projects related to COBOL development. One such project was the ""Jachin COBOL-to-Java RPC Conversion Future Design."" In this challenge, participants were tasked with designing a multi-layer Java architecture to convert COBOL RPCs to Java programs, which would be accessible as web services. The goal was to adapt the design to Topcoder's methodology, provide instructions for converting COBOL RPCs using the design, and propose performance and maintainability enhancements. This indicates Topcoder's capability to handle COBOL-related projects. For more details, you can visit the Topcoder community page.",This is a good answer that leverages the challenge feed in addition to case studies.
Has Topcoder delivered projects subject to HIPPA?  Provide examples and links if possible.  Keep your answer to 1000 words or less.,"Topcoder has experience in the healthcare industry, where compliance with HIPAA (Health Insurance Portability and Accountability Act) is crucial. However, specific examples of projects delivered by Topcoder that are subject to HIPAA regulations are not detailed in the available resources. They are known for their expertise in healthcare projects, which implies an understanding and adherence to HIPAA guidelines for protecting patient data. For further information about their healthcare projects, you can visit Topcoder's Healthcare & Life Sciences page.  https://www.topcoder.com/customer/industries/",This query is expected to return specific case studies (CMS)
What experience can Topcoder show in differential privacy?,"Based on a quick search, here's what I found.

Topcoder has indeed demonstrated experience in differential privacy through its involvement in the 2018 Differential Privacy Synthetic Data Challenge, hosted by the National Institute of Standards and Technology (NIST). In this challenge, participants on the Topcoder platform were tasked with creating or improving methods of data de-identification while ensuring the utility of the dataset for analysis. All solutions had to satisfy the rigorous differential privacy guarantee, a provable guarantee of individual privacy protection. The challenge showcased Topcoder's capability to handle projects that require advanced privacy-preserving techniques in data analysis. For more details, you can visit the NIST website. https://www.nist.gov/ctl/pscr/open-innovation-prize-challenges/past-prize-challenges/2018-differential-privacy-synthetic",This query is expected to return file system links to the differential privacy case studies
Show me what work Topcoder has delivered in Web 3.0 or blockchain or related subjects.  Show links to case studies where possible.  Use fewer than 1000 words.,"Topcoder has demonstrated significant involvement in Web 3.0 and blockchain-related projects, showcasing their versatility and adaptability to emerging technologies. Here are a couple of examples:

Xerox Global Tracking Blockchain Proof of Concept: Topcoder partnered with Wipro to explore design concepts for a Product Lifecycle Tracking app using Blockchain technology for Xerox. The challenge was to demonstrate how Blockchain could be used to provide new levels of visibility into the print hardware lifecycle. Topcoder delivered sixteen unique design solutions, offering Xerox various approaches to solving their problem. This project demonstrated the utilization of Blockchain for tracking items across multiple companies and software systems, providing a unified view of the entire distributed value chain. This collaboration enabled Xerox to quickly move from concept to proof of concept, significantly exploring Blockchain's potential in their business. More details can be found on Topcoder's case study page for Xerox.

Building Apps on Ethereum: Topcoder has also tapped into the Ethereum blockchain, a decentralized platform for deploying smart contracts. They partnered with ConsenSys Diligence, a branch of ConsenSys, to close the talent gap in designing and building enterprise-grade Ethereum solutions. The Topcoder Blockchain Community, a segment of the broader Topcoder community, went from concept to go-live in under 60 days. This community provides access to a large pool of developers with expertise in Blockchain technology, accelerating go-to-market strategies and reducing time to market for Ethereum applications. Further details about this initiative are available on Topcoder's case study page for Building Apps on Ethereum.

Additionally, the Topcoder Blockchain Community focuses on decentralized applications (DApps) on the Ethereum platform, allowing participants to learn, build, and collaborate on cutting-edge solutions in blockchain technology. This initiative emphasizes educational resources, challenges, and opportunities for real-world customer projects with Ethereum blockchain. You can explore more about the Topcoder Blockchain Community at Topcoder's Blockchain Community page.

These projects illustrate Topcoder's capability to engage in complex and innovative areas like blockchain and Web 3.0, leveraging their community's diverse skills and expertise.",
What work has Topcoder delivered in infectious diseases?  Give links and use fewer than 1000 words.,"Topcoder has engaged in a wide range of innovative projects, but there is no specific information available on their website about projects directly related to infectious diseases. They have worked on diverse challenges across various industries, including healthcare, but details on infectious disease-related projects are not provided in their case studies archive. For more information about the types of projects Topcoder has undertaken, you can explore their Case Studies Archive.",This should return COVID-19
What work has Topcoder delivered related to COVID?  Give links and use fewer than 1000 words.,"Topcoder has actively engaged in various initiatives related to COVID-19, leveraging its community of developers, designers, and data scientists. They have hosted challenges and hackathons aimed at fostering innovation and providing solutions to combat the impacts of the coronavirus. This includes an Anti-Coronavirus Hackathon dedicated to helping various groups like governments, healthcare workers, and society deal with the pandemic's impacts. Additionally, they've provided resources and webinars to help individuals learn new skills and stay productive during the pandemic. Topcoder's efforts demonstrate their commitment to using their platform and community to contribute positively in times of crisis.

For more detailed information on Topcoder's initiatives and challenges related to COVID-19, you can visit their pages dedicated to COVID-19 response and innovation:

Topcoder COVID-19 Resources (https://www.topcoder.com/covid-19/)
Topcoder in the Time of COVID-19  (https://www.topcoder.com/community/stayhome)
Innovating with COVID-19 at Topcoder (https://www.topcoder.com/resources/innovating-with-covid-19/)",
Has Topcoder worked with robots?  What kind of problems has it solved if so?  How about medical robotics?  Use fewer than 1000 words and give links.,"Topcoder has engaged in multiple robotics-related projects over the years, including some in collaboration with NASA. For instance, in 2013, Topcoder hosted the first Robonaut Challenge, where the community was tasked with developing algorithms to help Robonaut, a humanoid robot, to recognize buttons and switches on a taskboard using both real and simulated imagery. This was part of a broader effort to improve Robonaut's visual tool manipulation capabilities for use both on Earth and on the International Space Station (ISS)__.

Another project included the InSPIRE Zero Robotics Farm Enhancement Architecture challenge, which focused on improving the backend and programming interface for the Zero Robotics website, a platform for a robotics programming tournament operated on the ISS__.

Additionally, Topcoder announced challenges to enhance Robonaut 2's capabilities aboard the ISS. These challenges aimed to enable Robonaut 2 to interact visually with various input devices used on the Space Station and involved creating algorithms to control the robot's motion based on visual data__.

While there is no specific mention of projects directly related to medical robotics on the Topcoder platform, the expertise and solutions generated through these challenges showcase Topcoder's capacity to handle complex robotics problems across different environments, including space, which could be analogous to some of the complexities faced in medical robotics.

For more detailed information, you can visit Topcoder's blog post on their collaboration with NASA for the Robonaut Challenge.",
"Has Topcoder worked on problems with shape recognition, especially in satellite images?  Can they do objection detection?  Give links and use fewer than 1000 words.","Topcoder has been actively involved in developing solutions for shape recognition, particularly in the context of satellite imagery, and has conducted challenges related to object detection. They have partnered with organizations for challenges that involve interpreting complex geospatial data, which includes recognizing structures and objects from satellite images.

One such initiative is the SpaceNet Challenges, where Topcoder community members develop computer vision algorithms to automate the analysis of satellite imagery. These challenges have focused on various aspects of satellite image analysis, including building footprint extraction, road network detection, and object detection from different angles of satellite imagery. The challenges aim to improve feature extraction to aid efforts like disaster response and urban planning.

For example, the SpaceNet 7 Challenge focused on detecting buildings using high-resolution satellite imagery combined with 3D data. This challenge required participants to develop algorithms that can recognize and differentiate buildings in complex urban landscapes. The scoring for this challenge was based on precision and involved evaluating the intersection over union (IoU) of the predicted building footprints against the ground truth data.

Another example includes work on building detectors where participants develop algorithms to process satellite images and identify building footprints, helping to improve the automation and accuracy of geospatial feature extraction.

These projects demonstrate Topcoder's capability in leveraging the crowd to tackle object detection and shape recognition in satellite imagery, which are complex and highly specialized tasks requiring advanced computer vision techniques.

For more detailed information on these projects and challenges, you can visit the following resources:

SpaceNet Datasets and Challenges on Topcoder Thrive (https://www.topcoder.com/thrive/articles/SpaceNet%20-%20Datasets)
SpaceNet on GitHub (https://github.com/SpaceNetChallenge)
Topcoder Challenge page for current and past challenges related to geospatial data and object detection. (https://www.topcoder.com/challenges)",
What government agencies has Topcoder worked with?  Give examples and use fewer than 1000 words.,"After a quick search, here's what I discovered.

Topcoder has collaborated with several government agencies and public sector organizations to help them succeed in digital transformation through crowdsourcing. Some notable examples include:

NASA: Topcoder has worked with NASA, particularly the Center of Excellence for Collaborative Innovation, on various open innovation projects. NASA was one of the first government agencies to utilize on-demand talent through platforms like Topcoder.

National Institute of Standards and Technology (NIST): Topcoder has engaged with NIST to develop differential privacy algorithms, which are essential for securing shared data pools between government and research teams.

U.S. Bureau of Reclamation (USBR): The agency has partnered with Topcoder for challenges involving weather algorithms, which contribute to the USBR's mission of managing water and power in the west of the United States.

United States Special Operations Command (USSOCOM): They've used Topcoder to expedite the development of algorithms, taking advantage of the platform's ability to break down projects into components that can be worked on externally, thus maintaining the security of sensitive information.

Additionally, Topcoder has been involved with SpaceNet, a collaborative effort that includes governmental entities, where they focus on geospatial machine learning applications. This collaboration emphasizes the development of open-source machine learning tools for geospatial analysis.

For more detailed insights into Topcoder's work with public sector agencies, you can explore the following resources:

Topcoder's Public Sector Partnerships
SpaceNet About Us",This is a very good answer because it mentions Spacenet too.
